{
  "type": "hardening_report",
  "generated_at": "2026-03-06T21:59:42Z",
  "scenarios": [
    "scan_inconsistencies"
  ],
  "findings": [
    {
      "kind": "legacy_oodle_ref",
      "path": ".claude/CHANGELOG.md",
      "details": "Contains obsolete .oodle path reference.",
      "severity": "error"
    },
    {
      "kind": "legacy_oodle_ref",
      "path": ".claude/governance/LEGACY_POLICY.md",
      "details": "Contains obsolete .oodle path reference.",
      "severity": "error"
    },
    {
      "kind": "legacy_oodle_ref",
      "path": ".claude/governance/legacy_purge_report.md",
      "details": "Contains obsolete .oodle path reference.",
      "severity": "error"
    },
    {
      "kind": "junk_in_repo",
      "path": ".claude/skills/analysis/code_assimilate/__pycache__/skill.cpython-310.pyc",
      "details": "Cache artifact present in tree (should be cleaned before archiving).",
      "severity": "warn"
    },
    {
      "kind": "junk_in_repo",
      "path": ".claude/skills/analysis/code_assimilate/__pycache__/__init__.cpython-310.pyc",
      "details": "Cache artifact present in tree (should be cleaned before archiving).",
      "severity": "warn"
    },
    {
      "kind": "junk_in_repo",
      "path": ".claude/skills/analysis/limitation_harvest_scan/__pycache__/skill.cpython-310.pyc",
      "details": "Cache artifact present in tree (should be cleaned before archiving).",
      "severity": "warn"
    },
    {
      "kind": "junk_in_repo",
      "path": ".claude/skills/analysis/limitation_harvest_scan/__pycache__/__init__.cpython-310.pyc",
      "details": "Cache artifact present in tree (should be cleaned before archiving).",
      "severity": "warn"
    },
    {
      "kind": "junk_in_repo",
      "path": ".claude/skills/analysis/mechanic_explain/__pycache__/skill.cpython-310.pyc",
      "details": "Cache artifact present in tree (should be cleaned before archiving).",
      "severity": "warn"
    },
    {
      "kind": "junk_in_repo",
      "path": ".claude/skills/analysis/mechanic_explain/__pycache__/__init__.cpython-310.pyc",
      "details": "Cache artifact present in tree (should be cleaned before archiving).",
      "severity": "warn"
    },
    {
      "kind": "junk_in_repo",
      "path": ".claude/skills/analysis/mutation_detect/__pycache__/skill.cpython-310.pyc",
      "details": "Cache artifact present in tree (should be cleaned before archiving).",
      "severity": "warn"
    },
    {
      "kind": "junk_in_repo",
      "path": ".claude/skills/analysis/mutation_detect/__pycache__/__init__.cpython-310.pyc",
      "details": "Cache artifact present in tree (should be cleaned before archiving).",
      "severity": "warn"
    },
    {
      "kind": "junk_in_repo",
      "path": ".claude/skills/analysis/pattern_detect/__pycache__/skill.cpython-310.pyc",
      "details": "Cache artifact present in tree (should be cleaned before archiving).",
      "severity": "warn"
    },
    {
      "kind": "junk_in_repo",
      "path": ".claude/skills/analysis/pattern_detect/__pycache__/__init__.cpython-310.pyc",
      "details": "Cache artifact present in tree (should be cleaned before archiving).",
      "severity": "warn"
    },
    {
      "kind": "junk_in_repo",
      "path": ".claude/skills/analysis/system_map/__pycache__/skill.cpython-310.pyc",
      "details": "Cache artifact present in tree (should be cleaned before archiving).",
      "severity": "warn"
    },
    {
      "kind": "junk_in_repo",
      "path": ".claude/skills/analysis/system_map/__pycache__/__init__.cpython-310.pyc",
      "details": "Cache artifact present in tree (should be cleaned before archiving).",
      "severity": "warn"
    },
    {
      "kind": "junk_in_repo",
      "path": ".claude/skills/analysis/__pycache__/__init__.cpython-310.pyc",
      "details": "Cache artifact present in tree (should be cleaned before archiving).",
      "severity": "warn"
    },
    {
      "kind": "junk_in_repo",
      "path": ".claude/skills/archive/last_train/__pycache__/skill.cpython-310.pyc",
      "details": "Cache artifact present in tree (should be cleaned before archiving).",
      "severity": "warn"
    },
    {
      "kind": "junk_in_repo",
      "path": ".claude/skills/archive/last_train/__pycache__/__init__.cpython-310.pyc",
      "details": "Cache artifact present in tree (should be cleaned before archiving).",
      "severity": "warn"
    },
    {
      "kind": "junk_in_repo",
      "path": ".claude/skills/archive/last_train_merge/__pycache__/skill.cpython-310.pyc",
      "details": "Cache artifact present in tree (should be cleaned before archiving).",
      "severity": "warn"
    },
    {
      "kind": "junk_in_repo",
      "path": ".claude/skills/archive/last_train_merge/__pycache__/__init__.cpython-310.pyc",
      "details": "Cache artifact present in tree (should be cleaned before archiving).",
      "severity": "warn"
    },
    {
      "kind": "junk_in_repo",
      "path": ".claude/skills/archive/__pycache__/__init__.cpython-310.pyc",
      "details": "Cache artifact present in tree (should be cleaned before archiving).",
      "severity": "warn"
    },
    {
      "kind": "junk_in_repo",
      "path": ".claude/skills/bundle/evidence_bundle_build/__pycache__/skill.cpython-310.pyc",
      "details": "Cache artifact present in tree (should be cleaned before archiving).",
      "severity": "warn"
    },
    {
      "kind": "junk_in_repo",
      "path": ".claude/skills/bundle/evidence_bundle_build/__pycache__/skill.cpython-313.pyc",
      "details": "Cache artifact present in tree (should be cleaned before archiving).",
      "severity": "warn"
    },
    {
      "kind": "junk_in_repo",
      "path": ".claude/skills/bundle/evidence_bundle_build/__pycache__/__init__.cpython-310.pyc",
      "details": "Cache artifact present in tree (should be cleaned before archiving).",
      "severity": "warn"
    },
    {
      "kind": "junk_in_repo",
      "path": ".claude/skills/bundle/evidence_bundle_build/__pycache__/__init__.cpython-313.pyc",
      "details": "Cache artifact present in tree (should be cleaned before archiving).",
      "severity": "warn"
    },
    {
      "kind": "junk_in_repo",
      "path": ".claude/skills/bundle/evidence_init/__pycache__/skill.cpython-310.pyc",
      "details": "Cache artifact present in tree (should be cleaned before archiving).",
      "severity": "warn"
    },
    {
      "kind": "junk_in_repo",
      "path": ".claude/skills/bundle/evidence_init/__pycache__/skill.cpython-313.pyc",
      "details": "Cache artifact present in tree (should be cleaned before archiving).",
      "severity": "warn"
    },
    {
      "kind": "junk_in_repo",
      "path": ".claude/skills/bundle/evidence_router/__pycache__/skill.cpython-310.pyc",
      "details": "Cache artifact present in tree (should be cleaned before archiving).",
      "severity": "warn"
    },
    {
      "kind": "junk_in_repo",
      "path": ".claude/skills/bundle/evidence_router/__pycache__/skill.cpython-313.pyc",
      "details": "Cache artifact present in tree (should be cleaned before archiving).",
      "severity": "warn"
    },
    {
      "kind": "junk_in_repo",
      "path": ".claude/skills/bundle/__pycache__/__init__.cpython-310.pyc",
      "details": "Cache artifact present in tree (should be cleaned before archiving).",
      "severity": "warn"
    },
    {
      "kind": "junk_in_repo",
      "path": ".claude/skills/bundle/__pycache__/__init__.cpython-313.pyc",
      "details": "Cache artifact present in tree (should be cleaned before archiving).",
      "severity": "warn"
    },
    {
      "kind": "junk_in_repo",
      "path": ".claude/skills/cleanup/cleanup_apply/__pycache__/skill.cpython-310.pyc",
      "details": "Cache artifact present in tree (should be cleaned before archiving).",
      "severity": "warn"
    },
    {
      "kind": "junk_in_repo",
      "path": ".claude/skills/cleanup/cleanup_apply/__pycache__/skill.cpython-313.pyc",
      "details": "Cache artifact present in tree (should be cleaned before archiving).",
      "severity": "warn"
    },
    {
      "kind": "junk_in_repo",
      "path": ".claude/skills/cleanup/cleanup_plan_apply/__pycache__/skill.cpython-310.pyc",
      "details": "Cache artifact present in tree (should be cleaned before archiving).",
      "severity": "warn"
    },
    {
      "kind": "junk_in_repo",
      "path": ".claude/skills/cleanup/cleanup_plan_apply/__pycache__/skill.cpython-313.pyc",
      "details": "Cache artifact present in tree (should be cleaned before archiving).",
      "severity": "warn"
    },
    {
      "kind": "junk_in_repo",
      "path": ".claude/skills/cleanup/code_clean/__pycache__/skill.cpython-310.pyc",
      "details": "Cache artifact present in tree (should be cleaned before archiving).",
      "severity": "warn"
    },
    {
      "kind": "junk_in_repo",
      "path": ".claude/skills/cleanup/code_clean/__pycache__/skill.cpython-313.pyc",
      "details": "Cache artifact present in tree (should be cleaned before archiving).",
      "severity": "warn"
    },
    {
      "kind": "junk_in_repo",
      "path": ".claude/skills/cleanup/code_clean_scan/__pycache__/skill.cpython-310.pyc",
      "details": "Cache artifact present in tree (should be cleaned before archiving).",
      "severity": "warn"
    },
    {
      "kind": "junk_in_repo",
      "path": ".claude/skills/cleanup/code_clean_scan/__pycache__/skill.cpython-313.pyc",
      "details": "Cache artifact present in tree (should be cleaned before archiving).",
      "severity": "warn"
    },
    {
      "kind": "junk_in_repo",
      "path": ".claude/skills/cleanup/repo_clean/__pycache__/skill.cpython-310.pyc",
      "details": "Cache artifact present in tree (should be cleaned before archiving).",
      "severity": "warn"
    },
    {
      "kind": "junk_in_repo",
      "path": ".claude/skills/cleanup/repo_clean/__pycache__/skill.cpython-313.pyc",